{
  "version": "1",
  "file": "password-auth.allium",
  "metadata": {
    "scope": "authentication",
    "description": "Password authentication with reset flow"
  },
  "use_declarations": [
    {
      "coordinate": "org.example:email-infrastructure",
      "alias": "email_infra"
    }
  ],
  "given": [
    {
      "name": "email_service",
      "type": {
        "kind": "entity_ref",
        "entity": "EmailService"
      }
    }
  ],
  "external_entities": [
    {
      "name": "Email",
      "fields": [
        {
          "name": "to",
          "type": { "kind": "primitive", "value": "String" }
        },
        {
          "name": "template",
          "type": { "kind": "primitive", "value": "String" }
        },
        {
          "name": "data",
          "type": {
            "kind": "optional",
            "inner": { "kind": "primitive", "value": "String" }
          }
        }
      ]
    },
    {
      "name": "EmailService",
      "fields": [
        {
          "name": "provider",
          "type": { "kind": "primitive", "value": "String" }
        },
        {
          "name": "is_configured",
          "type": { "kind": "primitive", "value": "Boolean" }
        }
      ]
    },
    {
      "name": "AuditLog",
      "fields": [
        {
          "name": "user",
          "type": { "kind": "entity_ref", "entity": "User" }
        },
        {
          "name": "event",
          "type": { "kind": "named_enum", "name": "AuthEventType" }
        },
        {
          "name": "timestamp",
          "type": { "kind": "primitive", "value": "Timestamp" }
        },
        {
          "name": "metadata",
          "type": {
            "kind": "optional",
            "inner": { "kind": "primitive", "value": "String" }
          }
        }
      ]
    }
  ],
  "value_types": [
    {
      "name": "TokenData",
      "fields": [
        {
          "name": "token_value",
          "type": { "kind": "primitive", "value": "String" }
        },
        {
          "name": "issued_at",
          "type": { "kind": "primitive", "value": "Timestamp" }
        }
      ],
      "derived_values": [
        {
          "name": "age",
          "expression": {
            "kind": "arithmetic",
            "operator": "-",
            "left": { "kind": "literal", "type": "timestamp", "value": "now" },
            "right": { "kind": "field_access", "object": null, "field": "issued_at" }
          }
        }
      ]
    }
  ],
  "enumerations": [
    {
      "name": "AuthEventType",
      "values": [
        "login_success",
        "login_failure",
        "password_reset",
        "account_locked",
        "account_unlocked"
      ]
    }
  ],
  "entities": [
    {
      "name": "User",
      "fields": [
        {
          "name": "email",
          "type": { "kind": "primitive", "value": "String" }
        },
        {
          "name": "password_hash",
          "type": { "kind": "primitive", "value": "String" }
        },
        {
          "name": "status",
          "type": {
            "kind": "inline_enum",
            "values": ["active", "locked", "deactivated"]
          }
        },
        {
          "name": "failed_login_attempts",
          "type": { "kind": "primitive", "value": "Integer" }
        },
        {
          "name": "locked_until",
          "type": {
            "kind": "optional",
            "inner": { "kind": "primitive", "value": "Timestamp" }
          }
        },
        {
          "name": "trusted_ips",
          "type": {
            "kind": "set",
            "element": { "kind": "primitive", "value": "String" }
          }
        }
      ],
      "relationships": [
        {
          "name": "sessions",
          "target_entity": "Session",
          "foreign_key": "user",
          "cardinality": "many"
        },
        {
          "name": "reset_tokens",
          "target_entity": "PasswordResetToken",
          "foreign_key": "user",
          "cardinality": "many"
        }
      ],
      "projections": [
        {
          "name": "active_sessions",
          "source": "sessions",
          "condition": {
            "kind": "comparison",
            "operator": "=",
            "left": { "kind": "field_access", "object": null, "field": "status" },
            "right": { "kind": "literal", "type": "enum_value", "value": "active" }
          }
        },
        {
          "name": "pending_reset_tokens",
          "source": "reset_tokens",
          "condition": {
            "kind": "comparison",
            "operator": "=",
            "left": { "kind": "field_access", "object": null, "field": "status" },
            "right": { "kind": "literal", "type": "enum_value", "value": "pending" }
          }
        }
      ],
      "derived_values": [
        {
          "name": "is_locked",
          "expression": {
            "kind": "boolean_logic",
            "operator": "and",
            "left": {
              "kind": "comparison",
              "operator": "=",
              "left": { "kind": "field_access", "object": null, "field": "status" },
              "right": { "kind": "literal", "type": "enum_value", "value": "locked" }
            },
            "right": {
              "kind": "comparison",
              "operator": ">",
              "left": { "kind": "field_access", "object": null, "field": "locked_until" },
              "right": { "kind": "literal", "type": "timestamp", "value": "now" }
            }
          }
        },
        {
          "name": "has_valid_session",
          "expression": {
            "kind": "collection_op",
            "operation": "any",
            "collection": { "kind": "field_access", "object": null, "field": "active_sessions" },
            "lambda": {
              "kind": "lambda",
              "parameter": "s",
              "body": {
                "kind": "field_access",
                "object": { "kind": "field_access", "object": null, "field": "s" },
                "field": "is_valid"
              }
            }
          }
        }
      ]
    },
    {
      "name": "Session",
      "fields": [
        {
          "name": "user",
          "type": { "kind": "entity_ref", "entity": "User" }
        },
        {
          "name": "created_at",
          "type": { "kind": "primitive", "value": "Timestamp" }
        },
        {
          "name": "expires_at",
          "type": { "kind": "primitive", "value": "Timestamp" }
        },
        {
          "name": "status",
          "type": {
            "kind": "inline_enum",
            "values": ["active", "expired", "revoked"]
          }
        }
      ],
      "relationships": [],
      "projections": [],
      "derived_values": [
        {
          "name": "is_valid",
          "expression": {
            "kind": "boolean_logic",
            "operator": "and",
            "left": {
              "kind": "comparison",
              "operator": "=",
              "left": { "kind": "field_access", "object": null, "field": "status" },
              "right": { "kind": "literal", "type": "enum_value", "value": "active" }
            },
            "right": {
              "kind": "comparison",
              "operator": ">",
              "left": { "kind": "field_access", "object": null, "field": "expires_at" },
              "right": { "kind": "literal", "type": "timestamp", "value": "now" }
            }
          }
        }
      ]
    },
    {
      "name": "PasswordResetToken",
      "fields": [
        {
          "name": "user",
          "type": { "kind": "entity_ref", "entity": "User" }
        },
        {
          "name": "created_at",
          "type": { "kind": "primitive", "value": "Timestamp" }
        },
        {
          "name": "expires_at",
          "type": { "kind": "primitive", "value": "Timestamp" }
        },
        {
          "name": "status",
          "type": {
            "kind": "inline_enum",
            "values": ["pending", "used", "expired"]
          }
        }
      ],
      "relationships": [],
      "projections": [],
      "derived_values": [
        {
          "name": "is_valid",
          "expression": {
            "kind": "boolean_logic",
            "operator": "and",
            "left": {
              "kind": "comparison",
              "operator": "=",
              "left": { "kind": "field_access", "object": null, "field": "status" },
              "right": { "kind": "literal", "type": "enum_value", "value": "pending" }
            },
            "right": {
              "kind": "comparison",
              "operator": ">",
              "left": { "kind": "field_access", "object": null, "field": "expires_at" },
              "right": { "kind": "literal", "type": "timestamp", "value": "now" }
            }
          }
        }
      ]
    }
  ],
  "variants": [],
  "config": [
    {
      "name": "min_password_length",
      "type": { "kind": "primitive", "value": "Integer" },
      "default_value": { "kind": "literal", "type": "integer", "value": 12 }
    },
    {
      "name": "max_login_attempts",
      "type": { "kind": "primitive", "value": "Integer" },
      "default_value": { "kind": "literal", "type": "integer", "value": 5 }
    },
    {
      "name": "lockout_duration",
      "type": { "kind": "primitive", "value": "Duration" },
      "default_value": { "kind": "literal", "type": "duration", "value": "15.minutes" }
    },
    {
      "name": "reset_token_expiry",
      "type": { "kind": "primitive", "value": "Duration" },
      "default_value": { "kind": "literal", "type": "duration", "value": "1.hour" }
    },
    {
      "name": "session_duration",
      "type": { "kind": "primitive", "value": "Duration" },
      "default_value": { "kind": "literal", "type": "duration", "value": "24.hours" }
    }
  ],
  "defaults": [
    {
      "entity": "User",
      "name": "system_user",
      "fields": {